{
  "schema_version": "1.0.0",
  "screening_id": "screen_lvt_19054418",
  "pmid": "19054418",
  "compound_group": "LVT",
  "partition": "train",
  "relevant_model": true,
  "recoverable_model": true,
  "exclusion_reason": null,
  "label_quality": "included_appendix_model",
  "source": {
    "path": "Supplements/LVT/Supplement_LVT_v2.docx",
    "sha256": "366f9c59b71d28cdbc53b4e37282f611af800ea34a400f4eb82946c22c5dd24b"
  }
}
