{
  "schema_version": "1.0.0",
  "screening_id": "screen_lvt_17442002",
  "pmid": "17442002",
  "compound_group": "LVT",
  "partition": "test",
  "relevant_model": false,
  "recoverable_model": false,
  "exclusion_reason": "explicitly_excluded_reason_unavailable",
  "label_quality": "explicit_exclusion",
  "source": {
    "path": "Supplements/LVT/articles/excluded/glauser-2007-17442002.pdf",
    "sha256": "823f9da2a28b736924f96898d86b9845566c659486946519c2c70fa4fd2fc6cf"
  }
}
