{
  "schema_version": "1.0.0",
  "screening_id": "screen_cbz_10217344",
  "pmid": "10217344",
  "compound_group": "CBZ",
  "partition": "train",
  "relevant_model": true,
  "recoverable_model": true,
  "exclusion_reason": null,
  "label_quality": "included_appendix_model",
  "source": {
    "path": "Supplements/CBZ/Supplement_CBZ_v2.docx",
    "sha256": "0d2ec13f9e7fc08ab529b8fc8d45eda7b5a87ad008d9c1931fa262a116bea1d4"
  }
}
