{
  "schema_version": "1.0.0",
  "screening_id": "screen_tpm_26395889",
  "pmid": "26395889",
  "compound_group": "TPM",
  "partition": "test",
  "relevant_model": true,
  "recoverable_model": true,
  "exclusion_reason": null,
  "label_quality": "included_appendix_model",
  "source": {
    "path": "Supplements/TPM/Supplement_TPM_v2.docx",
    "sha256": "787967aa7c3412e38a96b3241a229e30daf1c8716a94187beb4eddc72e2c29d1"
  }
}
