{
  "schema_version": "1.0.0",
  "screening_id": "screen_vpa_19067436",
  "pmid": "19067436",
  "compound_group": "VPA",
  "partition": "train",
  "relevant_model": true,
  "recoverable_model": true,
  "exclusion_reason": null,
  "label_quality": "included_appendix_model",
  "source": {
    "path": "Supplements/VPA/Supplement_VPA_v2.docx",
    "sha256": "aceb4d7288f39ada789bd3fed72c48f7852a5dd57f06970372e9ffe0737b946b"
  }
}
